{
  "contract": "publishing-house.workflow-blocker/v1",
  "schema_name": "publishing-house.workflow-blocker",
  "schema_version": "1.0.0",
  "workflow_id": "publishing-house-approval-publication",
  "workflow_version": "0.1.0",
  "run_id": "run-fixture",
  "created_at": "2026-08-14T14:00:00Z",
  "state": "blocked",
  "code": "approval_required",
  "message": "Exact human approval is required.",
  "required_capability": "versionseal",
  "next_action": "provide a VersionSeal decision",
  "retryable": false,
  "external_effect_occurred": false
}
